### ISSUE TITLE
STATUS_INVALID_PARAMETER while connecting to cifs server.

### ISSUE THREAD

**Issue by contactr2m** [CoreSecurity/impacket#233]
Hello,

I've been long time user of impacket lib for smb2/3 ops purpose.

I'm trying to connect to NetApp CIFS server using SMBConnection or SMB3 instance directly too.but i get invalid status error on below scenarios. 

I see that Negotiate request/response went well. 
Negotiate response
{{{
Frame 174: 284 bytes on wire (2272 bits), 284 bytes captured (2272 bits)
Ethernet II, Src: HewlettP_d7:5e:c0 (00:9c:02:d7:5e:c0), Dst: Apple_c6:56:be (78:31:c1:c6:56:be)
Internet Protocol Version 4, Src: 10.1.9.175, Dst: 10.2.5.12
Transmission Control Protocol, Src Port: 445, Dst Port: 64322, Seq: 1, Ack: 111, Len: 218
NetBIOS Session Service
SMB2 (Server Message Block Protocol version 2)
    SMB2 Header
    Negotiate Protocol Response (0x00)
        StructureSize: 0x0041
        Security mode: 0x01, Signing enabled
        Dialect: 0x0202
        NegotiateContextCount: 0
        Server Guid: 00000015-b63d-0da0-c778-844ebee2a553
        Capabilities: 0x00000001, DFS
        Max Transaction Size: 65536
        Max Read Size: 65536
        Max Write Size: 65536
        Current Time: Dec  1, 2016 11:41:05.799077000 EST
        Boot Time: Sep 12, 2016 10:53:20.891304000 EDT
        Security Blob: 605406062b0601050502a04a3048a024302206092a864882...
            Offset: 0x00000080
            Length: 86
            GSS-API Generic Security Service Application Program Interface
                OID: 1.3.6.1.5.5.2 (SPNEGO - Simple Protected Negotiation)
                Simple Protected Negotiation
                    negTokenInit
                        mechTypes: 3 items
                            MechType: 1.2.840.48018.1.2.2 (MS KRB5 - Microsoft Kerberos 5)
                            MechType: 1.2.840.113554.1.2.2 (KRB5 - Kerberos 5)
                            MechType: 1.3.6.1.4.1.311.2.2.10 (NTLMSSP - Microsoft NTLM Security Support Provider)
                        negHints
                            hintName: server_name@domain_name <-- hided on purpose 
        NegotiateContextOffset: 0x0000
}}}

Session setup request
{{{
Frame 207: 224 bytes on wire (1792 bits), 224 bytes captured (1792 bits)
Ethernet II, Src: Apple_c6:56:be (78:31:c1:c6:56:be), Dst: HewlettP_d7:5e:c0 (00:9c:02:d7:5e:c0)
Internet Protocol Version 4, Src: 10.2.5.12, Dst: 10.1.9.175
Transmission Control Protocol, Src Port: 64322, Dst Port: 445, Seq: 111, Ack: 219, Len: 158
NetBIOS Session Service
SMB2 (Server Message Block Protocol version 2)
    SMB2 Header
    Session Setup Request (0x01)
        StructureSize: 0x0019
        Flags: 0
        Security mode: 0x01, Signing enabled
        Capabilities: 0x00000001, DFS
        Channel: None (0x00000000)
        Previous Session Id: 0x0000000000000000
        Security Blob: 604006062b0601050502a0363034a00e300c060a2b060104...
            Offset: 0x00000058
            Length: 66
            GSS-API Generic Security Service Application Program Interface
                OID: 1.3.6.1.5.5.2 (SPNEGO - Simple Protected Negotiation)
                Simple Protected Negotiation
                    negTokenInit
                        mechTypes: 1 item
                            MechType: 1.3.6.1.4.1.311.2.2.10 (NTLMSSP - Microsoft NTLM Security Support Provider)
                        mechToken: 4e544c4d5353500001000000078208200000000000000000...
                        NTLM Secure Service Provider
                            NTLMSSP identifier: NTLMSSP
                            NTLM Message Type: NTLMSSP_NEGOTIATE (0x00000001)
                            Negotiate Flags: 0x20088207, Negotiate 128, Negotiate Extended Security, Negotiate NTLM key, Request Target, Negotiate OEM, Negotiate UNICODE
                            Calling workstation domain: NULL
                            Calling workstation name: NULL
}}}

Session setup response. 
{{{
Frame 208: 143 bytes on wire (1144 bits), 143 bytes captured (1144 bits)
Ethernet II, Src: HewlettP_d7:5e:c0 (00:9c:02:d7:5e:c0), Dst: Apple_c6:56:be (78:31:c1:c6:56:be)
Internet Protocol Version 4, Src: 10.1.9.175, Dst: 10.2.5.12
Transmission Control Protocol, Src Port: 445, Dst Port: 64322, Seq: 219, Ack: 269, Len: 77
NetBIOS Session Service
SMB2 (Server Message Block Protocol version 2)
    SMB2 Header
        Server Component: SMB2
        Header Length: 64
        Credit Charge: 0
        NT Status: STATUS_INVALID_PARAMETER (0xc000000d)
        Command: Session Setup (1)
        Credits granted: 0
        Flags: 0x00000001, Response
        Chain Offset: 0x00000000
        Message ID: 0
        Process Id: 0x00000000
        Tree Id: 0x00000000
        Session Id: 0x0000000000000000
        Signature: 00000000000000000000000000000000
        [Response to: 207]
        [Time from request: 0.002369000 seconds]
    Session Setup Response (0x01)
        StructureSize: 0x0009
        Session Flags: 0x0000
        Security Blob: <MISSING>: NO DATA
            Offset: 0x00000000
            Length: 0
}}}

Scenario : 1
NetApp server with SMB2 dialect, login fails.
`{
>>> c = SMBConnection(remoteName='netapp-server', remoteHost='10.1.9.175', myName=None, sess_port=445, preferredDialect=514)
>>> c.login("user1", "password1", "domain1")
Traceback (most recent call last):
  File "<input>", line 1, in <module>
  File "/usr/local/lib/python2.7/site-packages/impacket/smbconnection.py", line 264, in login
    raise SessionError(e.get_error_code())
SessionError: SMB SessionError: STATUS_INVALID_PARAMETER(An invalid parameter was passed to a service or function.)`

I connect to our private CIFS server successfully when i provide valid dialect.
`{
>>> c = SMBConnection(remoteName='local-1', remoteHost='10.1.29.12', myName=None, sess_port=445, preferredDialect=514)
>>> c.login("user1", "password1", "domain1")
True
>>> c.getDialect()
514  <--- SMB2`

Scenario: 2
Local server:
If i dont provide preferredDialect then it fails in negotiation step itself.

`{
>>> c = SMBConnection(remoteName='local-1', remoteHost='10.1.29.12', myName=None, sess_port=445, preferredDialect=None)
Traceback (most recent call last):
  File "<input>", line 1, in <module>
  File "/usr/local/lib/python2.7/site-packages/impacket/smbconnection.py", line 74, in __init__
    self.negotiateSession(preferredDialect)
  File "/usr/local/lib/python2.7/site-packages/impacket/smbconnection.py", line 118, in negotiateSession
    session=self._nmbSession, preferredDialect=514)
  File "/usr/local/lib/python2.7/site-packages/impacket/smb3.py", line 242, in __init__
    self.negotiateSession(preferredDialect)
  File "/usr/local/lib/python2.7/site-packages/impacket/smb3.py", line 458, in negotiateSession
    ans = self.recvSMB(packetID)
  File "/usr/local/lib/python2.7/site-packages/impacket/smb3.py", line 381, in recvSMB
    data = self._NetBIOSSession.recv_packet(self._timeout)
  File "/usr/local/lib/python2.7/site-packages/impacket/nmb.py", line 854, in recv_packet
    data = self.__read(timeout)
  File "/usr/local/lib/python2.7/site-packages/impacket/nmb.py", line 932, in __read
    data = self.read_function(4, timeout)
  File "/usr/local/lib/python2.7/site-packages/impacket/nmb.py", line 921, in non_polling_read
    raise NetBIOSError, ('Error while reading from remote', ERRCLASS_OS, None)
NetBIOSError: Error while reading from remote`

NetApp cifs server with no preferredDialect STATUS_INVALID_PARAMETER.
So it actually reads from the socket but gets unexpected status in negotiation phase.
`{
>>> c = SMBConnection(remoteName='netapp-server', remoteHost='10.1.9.175', myName=None, sess_port=445, preferredDialect=None)
Traceback (most recent call last):
  File "<input>", line 1, in <module>
  File "/usr/local/lib/python2.7/site-packages/impacket/smbconnection.py", line 74, in __init__
    self.negotiateSession(preferredDialect)
  File "/usr/local/lib/python2.7/site-packages/impacket/smbconnection.py", line 118, in negotiateSession
    session=self._nmbSession, preferredDialect=514)
  File "/usr/local/lib/python2.7/site-packages/impacket/smb3.py", line 242, in __init__
    self.negotiateSession(preferredDialect)
  File "/usr/local/lib/python2.7/site-packages/impacket/smb3.py", line 459, in negotiateSession
    if ans.isValidAnswer(STATUS_SUCCESS):
  File "/usr/local/lib/python2.7/site-packages/impacket/smb3structs.py", line 430, in isValidAnswer
    raise smb3.SessionError(self['Status'], self)
SessionError: SMB SessionError: STATUS_INVALID_PARAMETER(An invalid parameter was passed to a service or function.)`

Settings on NetApp server
{{{
netapp-server> options cifs.smb2
cifs.smb2.enable             on
cifs.smb2.signing.max_threads 0
cifs.smb2.signing.multiprocessing disabled
cifs.smb2.signing.required   off
cifs.smb2_1.branch_cache.enable off
cifs.smb2_1.branch_cache.hash_time_out 3600       (value might be overwritten in takeover)
netapp-server> options cifs.signing
cifs.signing.enable          off
}}}

I have compared pcap from mac/windows while connecting to cifs server using libsmb.py
haven't found any field that is wrong or unexpected.
I have also checked NTLMSSP flags and tried variations to see if there is any unsupported flag. but luck.

I can connect to same cifs servers from windows 7 using smb2.

Any help would be appreciated, where to look or if am i missing any setting on server side. 

Thank you.

**Comment by asolino** [comment]
Hey @contactr2m thanks for the report. A few questions/requests (have in mind I don't have NetApp devices knowledge):

1. What is the impacket version you're using?
2. Scenario 1: You mentioned a 'private CIFS server', I am assuming that server is a Windows/Samba one correct?
3. Scenario 2: What's the local server OS? 
4. Did you try with SMB1 (`preferredDialect = smb.SMB_DIALECT`)? Just checking problem is limited to SMB2+
5. I know it's kind of sensitive but, is there any change to get the actual pcap file for the connection attempt?

thanks

**Comment by contactr2m** [comment]
Thanks for the response @asolino 
1. I'am using impacket 0.9.16
2. Yes its Samba 3.6.3
3. Local server on which Samba runs is FreeBSD.
4.
Yes when i use SMB1 both local server and NetApp server connection works.
{{{
>>> c = SMBConnection(remoteName='local-1', remoteHost='10.1.9.175', myName=None, sess_port=445, preferredDialect=SMB_DIALECT)
>>> c.login("user1", "password1", "domain1")
>>> c.getDialect()
'NT LM 0.12'
>>> c.listShares()
[<impacket.dcerpc.v5.srvs.SHARE_INFO_1 object at 0x105d97750>, 
...
}}}
When i specify SMB2, local server works but NetApp cifs server connection does not. 
5.Here you go.. 
[sessionSetup.pcap.zip] (https://github.com/CoreSecurity/impacket/files/625563/sessionSetup.pcap.zip)

I can provide as much info as i can for NetApp, and yes if it works for NetApp,we will make it work for our private server.  If you want me to execute any steps let me know.

Thank you

**Comment by contactr2m** [comment]
Only thing i saw in pcap which was bit unexpected is negoHint
It should be  "not_defined_in_RFC4178@please_ignore" ?  than "server-name@domain-name"  ?
Or it does not matter ?

**Comment by contactr2m** [comment]
The behavior "NetBIOSError: Error while reading from remote" is may be due to below stuff:

When preferredDialect is None smbconnection does this:
{{{
- smbconnection.py:108  If no preferredDialect sent, we try the highest available one.

- smbconnection.py:114 If SMB2 packet it tries to connect through SMB3.

- smb3.py:242 But in SMB3 we again try to negotiate using SMB2 Negotiation. 

- smb3.py: 449 negSession['Dialects'] = [SMB2_DIALECT_002, SMB2_DIALECT_21, SMB2_DIALECT_30]
}}}
If Connection.NegotiateDialect is 0x0202, 0x0210, 0x0300, 0x0302, or 0x0311, the server MUST disconnect the connection, as specified in section 3.3.7.1, and not reply.

**Comment by asolino** [comment]
> Only thing i saw in pcap which was bit unexpected is negoHint
It should be "not_defined_in_RFC4178@please_ignore" ? than "server-name@domain-name" ?
Or it does not matter ?

I don't think that matters.

Thanks a lot for the pcaps, they gave me some guidelines but still no clues. I might need more specific data please. For the sake of simplicity, when instantiating `SMBConnection` set `remoteName` and `remoteHost` to the IP address and don't specify `myName` (e.g. `c = SMBConnection(remoteName='10.1.9.175', remoteHost='10.1.9.175', sess_port=445, preferredDialect=None)`
1. I'm assuming `10.1.9.175` is the NetApp device and `10.1.29.12` the Samba 3.6.3. Please correct me if I'm wrong.
2. I need a pcap against `10.1.9.175` using impacket with `preferredDialect=None` and `preferredDialect=SMB2_DIALECT_002`
3. I need a pcap against `10.1.9.175` using a MAC/Windows machine, assuming the connection is successful. 
4. I need a pcap against `10.1.29.12` using impacket with `preferredDialect=None`

cheers mate.

**Comment by asolino** [comment]
> While connecting to CIFS server from windows 7 machine, it does same thing like impacket SMB_COM_NEGOTIATE but then it receives the response in SMB2_NEGOTIATE_RESPONSE
and it does not send SMB2_NEGOTIATE request again.
{{{
SMB	SMB:C; Negotiate, Dialect = PC NETWORK PROGRAM 1.0, LANMAN1.0, Windows for Workgroups 3.1a, LM1.2X002, LANMAN2.1, NT LM 0.12, SMB 2.002, SMB 2.???
SMB2	SMB2:R NEGOTIATE (0x0), GUID={53A5E2BE-4E84-78C7-0DA0-B63D00000015}
SMB2	SMB2:C SESSION SETUP (0x1) {SMBOverTCP:108, TCP:107, IPv4:106}
}}}

That's an interesting observation. Good to know you're reading [MS-SMB2] too 👍

**Comment by asolino** [comment]
Btw, just tested against a Samba 4+ and I have no problems connecting. There's something else going on.

**Comment by contactr2m** [comment]
1. Yes, 10.1.9.175 is the NetApp device and 10.1.29.12 the Samba 3.6.3.
Adding pcaps. Names will state which one is for what.
[LocalServer_impacket_None.pcap.zip](https://github.com/CoreSecurity/impacket/files/625791/LocalServer_impacket_None.pcap.zip)
[NetApp_impacket_None.pcap.zip](https://github.com/CoreSecurity/impacket/files/625792/NetApp_impacket_None.pcap.zip)
[NetApp_impacket_SMB2.pcap.zip](https://github.com/CoreSecurity/impacket/files/625789/NetApp_impacket_SMB2.pcap.zip)
[NetApp_Mac_SessionSetup_Success.pcap.zip](https://github.com/CoreSecurity/impacket/files/625790/NetApp_Mac_SessionSetup_Success.pcap.zip)

Thanks for taking a look into it.

**Comment by contactr2m** [comment]
> Can't understand why it doesn't send a SMB2_NEGOTIATE. Take a look at the traffic again.

>When preferredDialect=None the first packet is a SMBv1 packet, you will see the answer is a SMB2 packet, with the dialect set to 0x02ff (SMB2 wildcard revision number).

NetApp and local cifs server only have SMB1 and SMB2 so they directly responds with actual highest dialect i.e 0x00000202 . You can check both pcaps for NetApp and Local server.

I have one more NetApp C-mode server with latest OS which supports SMB3 too. 
I took pcap for that and yes it does responds with 
DialectRevision: (0x2ff) - SMB2 wildcard revision number.
{{{
10.1.10.149	XLG43 	SMB2	SMB2:R   NEGOTIATE (0x0), 
XLG43 	10.1.10.149	SMB2	SMB2:C   NEGOTIATE (0x0), 
10.1.10.149	XLG43 	SMB2	SMB2:R   NEGOTIATE (0x0), 
10.1.10.149	SMB2	SMB2:C   SESSION SETUP (0x1) 	
}}}
 So in local server, NetApp 7 mode case they dont respond with wild card number so dont need another negotiation. So server dropping the connection looks legit. 
I will have to modify the impacket code locally to build SMB2NegotiateResponse with data from SMB_COM_NEGOTIATE. 
Any suggestions ? or guidance on that ? like how to get that SMB2 packet from SMB_COM_NEGOTIATE reponse ? 

status_invalid_parameter on login is still messed up though ...

**Comment by asolino** [comment]
> So in local server, NetApp 7 mode case they dont respond with wild card number so dont need another negotiation. So server dropping the connection looks legit.
I will have to modify the impacket code locally to build SMB2NegotiateResponse with data from SMB_COM_NEGOTIATE.
Any suggestions ? or guidance on that ? like how to get that SMB2 packet from SMB_COM_NEGOTIATE reponse ?

I just made that change.. take a look at https://github.com/CoreSecurity/impacket/commit/a298662c7bc7afcf342839968d92a0e00e015ae3. 
Let me know if it helps the first part of the problem.. if so we can attack the second one :)

**Comment by contactr2m** [comment]
I was doing exactly same thing lol, but you are quick at it :)
let me check if that works.. 
Thank you

**Comment by asolino** [comment]
> Yes, 10.1.9.175 is the NetApp device and 10.1.29.12 the Samba 3.6.3.
Adding pcaps. Names will state which one is for what.
LocalServer_impacket_None.pcap.zip
NetApp_impacket_None.pcap.zip
NetApp_impacket_SMB2.pcap.zip
NetApp_Mac_SessionSetup_Success.pcap.zip
Using Mac for all as Mac uses some different flags while negotiating.
Thanks for taking a look into it.

Thanks to you @contactr2m. Looking at them..

**Comment by contactr2m** [comment]
> I just made that change.. take a look at a298662.
Let me know if it helps the first part of the problem.. if so we can attack the second one :)

Local server:
Negotiation with preferredDialect = None : Works 💯 
SessionSetup : Works 💯 
{{{
>>> c = SMBConnection(remoteName='local-1', remoteHost='10.1.29.15', sess_port=445, preferredDialect=None)
>>> c.login("user1", "password1", "domain1")
True
>>> c.getDialect()
514
>>> c.getSMBServer()
<impacket.smb3.SMB3 instance at 0x1079e77e8>
}}}

NetApp server:
Negotiation with preferredDialect = None : Works 💯 
SessionSetup :  👎   We have to dig into this !!
{{{
>>> c = SMBConnection(remoteName='netapp-server', remoteHost='10.1.9.175', sess_port=445, preferredDialect=None)
>>> c.getDialect()
514
>>> c.login("user1", "password1", "doamin1")
Traceback (most recent call last):
  File "<stdin>", line 1, in <module>
  File "/usr/local/lib/python2.7/site-packages/impacket/smbconnection.py", line 262, in login
    raise SessionError(e.get_error_code())
impacket.smbconnection.SessionError: SMB SessionError: STATUS_INVALID_PARAMETER(An invalid parameter was passed to a service or function.)
}}}

I have a wrapper over SMBConnection so i do not mess up with underlying libs, Negotiation change had to modify smb3.py. Thanks you for [a298662](https://github.com/CoreSecurity/impacket/commit/a298662c7bc7afcf342839968d92a0e00e015ae3) 👍

**Comment by asolino** [comment]
Thanks for checking!.. We're getting closer..

> c = SMBConnection(remoteName='netapp-server', remoteHost='10.1.9.175', sess_port=445, preferredDialect=None)
c.getDialect()
514
c.login("user1", "password1", "doamin1")
Traceback (most recent call last):
File "", line 1, in 
File "/usr/local/lib/python2.7/site-packages/impacket/smbconnection.py", line 262, in login
raise SessionError(e.get_error_code())
impacket.smbconnection.SessionError: SMB SessionError: STATUS_INVALID_PARAMETER(An invalid parameter was passed to a service or function.)
}}}

Ok.. with the new changes, can you send me a new pcap of this?

**Comment by contactr2m** [comment]
Very close
[NetApp_impacket_mac_None.pcap.zip](https://github.com/CoreSecurity/impacket/files/627520/NetApp_impacket_mac_None.pcap.zip)

Above pcap contains session connect from impacket first
then session connect from mac to netapp cifs server.

NTLMSSP FLAGS are not as expected
Challenge:
{{{
Negotiate Flags: 0x20890205, Negotiate 128, Negotiate Target Info, Negotiate Extended Security, Target Type Domain, Negotiate NTLM key, Request Target, Negotiate UNICODE
}}}
request:
{{{
Host name: NULL
Session Key: Empty
Negotiate Flags: 0xa0880205, Negotiate 56, Negotiate 128, Negotiate Target Info, Negotiate Extended Security, Negotiate NTLM key, Request Target, Negotiate UNICODE
}}}

**Comment by asolino** [comment]
Hmm.. there's something I don't understand and can't reproduce here.

Take a looks at packet 175:
`Message ID: 1`
then in the `AUTH` packet (packet 178):
`Message ID: 1`

when it should be 2.

On my side, Message IDs are incremental.

**Comment by contactr2m** [comment]
Some how self._Connection['SequenceWindow'] is set to 1 again when packet is sent again when we receive STATUS_MORE_PROCESSING_REQUIRED

its incremented one first call
        if packet['Command'] is not SMB2_CANCEL:
            packet['MessageID'] = self._Connection['SequenceWindow']
            self._Connection['SequenceWindow'] += 1

but when sendSMB is called at next time,  self._Connection['SequenceWindow'] is not 2 but 1

**Comment by contactr2m** [comment]
Its updated at recvSMB() call
{{{
        if packet['MessageID'] == packetID or packetID is None:
        #    if self._Session['SigningRequired'] is True:
        #        self.signSMB(packet)
            # Let's update the sequenceWindow based on the CreditsCharged
            self._Connection['SequenceWindow'] += (packet['CreditCharge'] - 1)
            return packet
}}}

**Comment by asolino** [comment]
That is weird, thanks for checking. We might be doing the wrong calculation. Can you make sure the second packet ID is incremental from the previous one? At least force it somehow, then we'll see how it should be done correctly.

**Comment by asolino** [comment]
> Let's update the sequenceWindow based on the CreditsCharged
self._Connection['SequenceWindow'] += (packet['CreditCharge'] - 1)

Changing that to:
```
if packet['CreditCharge'] > 0:
    self._Connection['SequenceWindow'] += (packet['CreditCharge'] - 1)
```

will be enough for this test I think (I'm not able to test it tho at the moment)

**Comment by contactr2m** [comment]
Manually increasing SequenceWindow did the trick..Session setup was successful.
So if packet['CreditCharge'] > 0: would work too.

**Comment by asolino** [comment]
Great to know. I don't understand why the NetApp server is returning `CreditCharge == 0`, that doesn't happen with any other implementation I saw. 

Guess I'll need to get back to [MS-SMB2] to better understand how to update the MessageID. For know please test that everything works as expected (with the proposed patch I mentioned).

thanks!

**Comment by contactr2m** [comment]
Yeah no sure why NetApp is behaving like that but when i connected through mac then even when CreditCharge was 0 MessageID was incremented to 2, so impacket should handle MessageID in better way may be..  but its use case specific, i have different servers on which i can test it.

Yes i will run some stuff on NetApp before i send green..  Thank you for all your help. 👍

**Comment by contactr2m** [comment]
Looks good to me !

**Comment by asolino** [comment]
Maybe `MessageID` calculation is dialect specific (most probably). Let's leave this ticket open till we find the right patch. 

Good to know it's working so far! Thanks for you help mate.

**Comment by asolino** [comment]
Hey @contactr2m, please test https://github.com/CoreSecurity/impacket/commit/a446089a3f3dcac393dcfdd2e0b0a71a420ed9be to check that everything's working on your side. If so please close this issue.

**Comment by contactr2m** [comment]
NetApp server: 
preferredDialect SMB2 with https://github.com/CoreSecurity/impacket/commit/a446089a3f3dcac393dcfdd2e0b0a71a420ed9be change.
does not work. 👎 
{{{
>c = SMBConnection("10.1.9.175", "10.1.9.175", preferredDialect=514)

Sending packet with SequenceWindow 0
Current SequenceWindow is 1
Current dialect:
Receive CreditCharge: 0
Receive SequenceWindow before: 1
Receive SequenceWindow after: 0

>c.login("user1", "password1", "domain1")

Sending packet with SequenceWindow 0
Current SequenceWindow is 1
Current dialect: 514
Receive CreditCharge: 0
Receive SequenceWindow before: 1

> Traceback (most recent call last):
>   File "<stdin>", line 1, in <module>
>   File "impacket/smbconnection.py", line 262, in login
>     raise SessionError(e.get_error_code())
> impacket.smbconnection.SessionError: SMB SessionError: STATUS_INVALID_PARAMETER(An invalid parameter was passed to a service or function.)
> 

}}}

preferredDialect SMB2 with  **"if packet['CreditCharge'] > 0:"**  change it works. 👍 
{{{
>c = SMBConnection("10.1.9.175", "10.1.9.175", preferredDialect=514)

Sending packet with SequenceWindow 0
Current SequenceWindow is 1
Current dialect:
Receive CreditCharge: 0
Receive SequenceWindow before: 1

>c.login("user1", "password1", "domain1")

Sending packet with SequenceWindow 1
Current SequenceWindow is 2
Current dialect: 514
Receive CreditCharge: 0
Receive SequenceWindow before: 2
Sending packet with SequenceWindow 2
Current SequenceWindow is 3
Current dialect: 514
Receive CreditCharge: 0
Receive SequenceWindow before: 3
True

}}}

I added some debug lines which prints those values for understanding.

**Comment by contactr2m** [comment]
NetApp server:
preferredDialect None with a446089 change.
{{{
> c = SMBConnection("10.1.9.175", "10.1.9.175", preferredDialect=None)
>c.login("devuser1", "devuser1", "dev")

Sending packet with SequenceWindow 1
Current SequenceWindow is 2
Current dialect: 514
Receive CreditCharge: 0
Receive SequenceWindow before: 2
Sending packet with SequenceWindow 2
Current SequenceWindow is 3
Current dialect: 514
Receive CreditCharge: 0
Receive SequenceWindow before: 3
True
}}}

**Comment by contactr2m** [comment]
Hrmm you need to change this
either initiate 
self._Connection ={'Dialect': 0} integer OR

change below comparison to 
if self._Connection['Dialect'] > str(SMB2_DIALECT_002):

Otherwise during negotiateSession() method call SequenceWindow is set back to 0 
because above comparison is always returns true due to type mismatch at least in python2.7

type(self._Connection['Dialect'])
<type 'str'>
type(SMB2_DIALECT_002)
<type 'int'>

**Comment by asolino** [comment]
Great analysis @contactr2m! Thanks a lot for checking it. Can you check again with the latest commit? I'm setting `self._Connection['Dialect']` to 0.

**Comment by contactr2m** [comment]
Working ! Thanks.

**Comment by asolino** [comment]
Excellent!.. Thanks a lot @contactr2m for your help. Your details on this issue allowed us to increase the SMB implementation coverage. Much appreciated!
